{
  "schema": "agenomic.conformance_vector/v1",
  "suite": "bm25",
  "id": "KM005",
  "intent": "no candidate matches",
  "consumers": [
    "rust-cloud",
    "python",
    "typescript"
  ],
  "input": {
    "query": "delta",
    "candidates": [
      "alpha beta",
      "gamma"
    ],
    "k1": "1.2",
    "b": "0.75",
    "corpus": null
  },
  "expected": {
    "ok": true,
    "ranked": []
  }
}
